{
  "slug": "demo",
  "fps": 30,
  "scenes": [
    {
      "id": "scene_000",
      "duration_ms": 3000,
      "bg": "gradient1",
      "audio_cue": null,
      "elements": [
        {
          "id": "scene_000_main",
          "type": "text",
          "content": "Transform your business with these 5 proven strategies",
          "x": 640.0,
          "y": 360.0,
          "width": null,
          "height": null,
          "keyframes": [
            {
              "t": 0,
              "x": null,
              "y": null,
              "scale": null,
              "rotate": null,
              "opacity": 0.0
            },
            {
              "t": 200,
              "x": null,
              "y": null,
              "scale": null,
              "rotate": null,
              "opacity": 1.0
            },
            {
              "t": 2700,
              "x": null,
              "y": null,
              "scale": null,
              "rotate": null,
              "opacity": 1.0
            },
            {
              "t": 3000,
              "x": null,
              "y": null,
              "scale": null,
              "rotate": null,
              "opacity": 0.0
            }
          ],
          "style": {
            "font_size": "body",
            "text_align": "center",
            "max_width": 1152
          }
        }
      ]
    },
    {
      "id": "scene_001",
      "duration_ms": 3000,
      "bg": "gradient1",
      "audio_cue": null,
      "elements": [
        {
          "id": "scene_001_main",
          "type": "text",
          "content": "Start with customer research and feedback analysis",
          "x": 640.0,
          "y": 360.0,
          "width": null,
          "height": null,
          "keyframes": [
            {
              "t": 0,
              "x": null,
              "y": null,
              "scale": null,
              "rotate": null,
              "opacity": 0.0
            },
            {
              "t": 200,
              "x": null,
              "y": null,
              "scale": null,
              "rotate": null,
              "opacity": 1.0
            },
            {
              "t": 2700,
              "x": null,
              "y": null,
              "scale": null,
              "rotate": null,
              "opacity": 1.0
            },
            {
              "t": 3000,
              "x": null,
              "y": null,
              "scale": null,
              "rotate": null,
              "opacity": 0.0
            }
          ],
          "style": {
            "font_size": "body",
            "text_align": "center",
            "max_width": 1152
          }
        }
      ]
    },
    {
      "id": "scene_002",
      "duration_ms": 3000,
      "bg": "gradient1",
      "audio_cue": null,
      "elements": [
        {
          "id": "scene_002_main",
          "type": "text",
          "content": "Optimize your online presence and branding",
          "x": 640.0,
          "y": 360.0,
          "width": null,
          "height": null,
          "keyframes": [
            {
              "t": 0,
              "x": null,
              "y": null,
              "scale": null,
              "rotate": null,
              "opacity": 0.0
            },
            {
              "t": 200,
              "x": null,
              "y": null,
              "scale": null,
              "rotate": null,
              "opacity": 1.0
            },
            {
              "t": 2700,
              "x": null,
              "y": null,
              "scale": null,
              "rotate": null,
              "opacity": 1.0
            },
            {
              "t": 3000,
              "x": null,
              "y": null,
              "scale": null,
              "rotate": null,
              "opacity": 0.0
            }
          ],
          "style": {
            "font_size": "body",
            "text_align": "center",
            "max_width": 1152
          }
        }
      ]
    },
    {
      "id": "scene_003",
      "duration_ms": 3000,
      "bg": "gradient1",
      "audio_cue": null,
      "elements": [
        {
          "id": "scene_003_main",
          "type": "text",
          "content": "Implement data-driven decision making processes",
          "x": 640.0,
          "y": 360.0,
          "width": null,
          "height": null,
          "keyframes": [
            {
              "t": 0,
              "x": null,
              "y": null,
              "scale": null,
              "rotate": null,
              "opacity": 0.0
            },
            {
              "t": 200,
              "x": null,
              "y": null,
              "scale": null,
              "rotate": null,
              "opacity": 1.0
            },
            {
              "t": 2700,
              "x": null,
              "y": null,
              "scale": null,
              "rotate": null,
              "opacity": 1.0
            },
            {
              "t": 3000,
              "x": null,
              "y": null,
              "scale": null,
              "rotate": null,
              "opacity": 0.0
            }
          ],
          "style": {
            "font_size": "body",
            "text_align": "center",
            "max_width": 1152
          }
        }
      ]
    },
    {
      "id": "scene_004",
      "duration_ms": 3000,
      "bg": "gradient1",
      "audio_cue": null,
      "elements": [
        {
          "id": "scene_004_main",
          "type": "text",
          "content": "Build strong team communication and collaboration",
          "x": 640.0,
          "y": 360.0,
          "width": null,
          "height": null,
          "keyframes": [
            {
              "t": 0,
              "x": null,
              "y": null,
              "scale": null,
              "rotate": null,
              "opacity": 0.0
            },
            {
              "t": 200,
              "x": null,
              "y": null,
              "scale": null,
              "rotate": null,
              "opacity": 1.0
            },
            {
              "t": 2700,
              "x": null,
              "y": null,
              "scale": null,
              "rotate": null,
              "opacity": 1.0
            },
            {
              "t": 3000,
              "x": null,
              "y": null,
              "scale": null,
              "rotate": null,
              "opacity": 0.0
            }
          ],
          "style": {
            "font_size": "body",
            "text_align": "center",
            "max_width": 1152
          }
        }
      ]
    },
    {
      "id": "scene_005",
      "duration_ms": 3000,
      "bg": "gradient1",
      "audio_cue": null,
      "elements": [
        {
          "id": "scene_005_main",
          "type": "text",
          "content": "Measure results and continuously improve",
          "x": 640.0,
          "y": 360.0,
          "width": null,
          "height": null,
          "keyframes": [
            {
              "t": 0,
              "x": null,
              "y": null,
              "scale": null,
              "rotate": null,
              "opacity": 0.0
            },
            {
              "t": 200,
              "x": null,
              "y": null,
              "scale": null,
              "rotate": null,
              "opacity": 1.0
            },
            {
              "t": 2700,
              "x": null,
              "y": null,
              "scale": null,
              "rotate": null,
              "opacity": 1.0
            },
            {
              "t": 3000,
              "x": null,
              "y": null,
              "scale": null,
              "rotate": null,
              "opacity": 0.0
            }
          ],
          "style": {
            "font_size": "body",
            "text_align": "center",
            "max_width": 1152
          }
        }
      ]
    },
    {
      "id": "scene_006",
      "duration_ms": 3000,
      "bg": "gradient1",
      "audio_cue": null,
      "elements": [
        {
          "id": "scene_006_main",
          "type": "text",
          "content": "Ready to get started? Download our free guide now",
          "x": 640.0,
          "y": 360.0,
          "width": null,
          "height": null,
          "keyframes": [
            {
              "t": 0,
              "x": null,
              "y": null,
              "scale": null,
              "rotate": null,
              "opacity": 0.0
            },
            {
              "t": 200,
              "x": null,
              "y": null,
              "scale": null,
              "rotate": null,
              "opacity": 1.0
            },
            {
              "t": 2700,
              "x": null,
              "y": null,
              "scale": null,
              "rotate": null,
              "opacity": 1.0
            },
            {
              "t": 3000,
              "x": null,
              "y": null,
              "scale": null,
              "rotate": null,
              "opacity": 0.0
            }
          ],
          "style": {
            "font_size": "body",
            "text_align": "center",
            "max_width": 1152
          }
        }
      ]
    }
  ],
  "metadata": {
    "compliance_percent": 100.0,
    "truncation_count": 0,
    "total_scenes": 7,
    "target_duration_sec": 7
  }
}